{
  "database": "vibeshop (Postgres 16)",
  "generatedAt": "2026-07-05T09:14:00Z",
  "healthScore": 61,
  "stats": {
    "tables": 14,
    "columns": 61,
    "fkCoverage": 0.27,
    "docCoverage": 1,
    "orphans": 3
  },
  "tables": [
    {
      "name": "users",
      "rows": 4,
      "status": "healthy",
      "readsPerDay": 18400,
      "writesPerDay": 120,
      "doc": "Core identity table. One row per registered account. `plan` drives feature gating in app code (values: free, pro, team \u2014 not enforced by constraint). Linked to Stripe via `stripe_customer_id`.",
      "issues": [
        "No unique index on email \u2014 duplicate accounts possible"
      ],
      "columns": [
        {
          "name": "id",
          "type": "bigint",
          "doc": "Primary key, referenced (often without FKs) across the schema."
        },
        {
          "name": "email",
          "type": "text",
          "doc": "Login identifier. NOT unique-indexed.",
          "flag": true
        },
        {
          "name": "name",
          "type": "text",
          "doc": "Display name."
        },
        {
          "name": "plan",
          "type": "text",
          "doc": "Billing tier: 'free' | 'pro' | 'team'. Enforced in app code only.",
          "flag": true
        },
        {
          "name": "stripe_customer_id",
          "type": "text",
          "doc": "Stripe customer ref; null for free users."
        },
        {
          "name": "created_at",
          "type": "timestamptz",
          "doc": "Signup time."
        }
      ]
    },
    {
      "name": "user_prefs",
      "rows": 2,
      "status": "warning",
      "readsPerDay": 2100,
      "writesPerDay": 40,
      "doc": "Per-user settings blob. `prefs` jsonb observed shape: {theme, digest, beta}. No FK to users \u2014 rows can outlive their user.",
      "issues": [
        "Missing FK: user_id \u2192 users.id",
        "Undocumented jsonb shape",
        "No primary key"
      ],
      "columns": [
        {
          "name": "user_id",
          "type": "bigint",
          "doc": "Logical FK to users.id (not enforced).",
          "flag": true
        },
        {
          "name": "prefs",
          "type": "jsonb",
          "doc": "Observed keys: theme ('dark'|'light'), digest ('daily'|'off'), beta (bool).",
          "flag": true
        },
        {
          "name": "updated",
          "type": "timestamptz",
          "doc": "Last write. Named inconsistently vs updated_at elsewhere."
        }
      ]
    },
    {
      "name": "workspaces",
      "rows": 2,
      "status": "warning",
      "readsPerDay": 9200,
      "writesPerDay": 15,
      "doc": "Team container. camelCase columns (\"ownerId\", \"createdAt\") \u2014 created by an AI codegen session, breaks the snake_case convention used everywhere else.",
      "issues": [
        "Missing FK: ownerId \u2192 users.id",
        "Naming drift: camelCase columns"
      ],
      "columns": [
        {
          "name": "id",
          "type": "bigint",
          "doc": "Primary key."
        },
        {
          "name": "ownerId",
          "type": "bigint",
          "doc": "Logical FK to users.id (not enforced). camelCase.",
          "flag": true
        },
        {
          "name": "name",
          "type": "text",
          "doc": "Workspace display name."
        },
        {
          "name": "createdAt",
          "type": "timestamptz",
          "doc": "Creation time. camelCase.",
          "flag": true
        }
      ]
    },
    {
      "name": "orders",
      "rows": 2,
      "status": "critical",
      "readsPerDay": 30,
      "writesPerDay": 0,
      "doc": "LEGACY. Replaced by orders_v2 in Aug 2025 but never dropped. Still referenced by order_items.order_id \u2014 the FK was never re-pointed. Do not build new features on this table.",
      "issues": [
        "Deprecated but still FK-referenced by order_items",
        "Zero writes in 90 days"
      ],
      "columns": [
        {
          "name": "id",
          "type": "bigint",
          "doc": "Primary key. Still the FK target of order_items (bug).",
          "flag": true
        },
        {
          "name": "user_id",
          "type": "bigint",
          "doc": "FK to users.id (one of the few real FKs)."
        },
        {
          "name": "total",
          "type": "numeric(10,2)",
          "doc": "Order total in dollars (v2 uses cents)."
        },
        {
          "name": "status",
          "type": "text",
          "doc": "Full-word statuses ('completed') \u2014 different vocabulary than v2."
        },
        {
          "name": "created_at",
          "type": "timestamptz",
          "doc": "Creation time."
        }
      ]
    },
    {
      "name": "orders_v2",
      "rows": 5,
      "status": "warning",
      "readsPerDay": 24600,
      "writesPerDay": 340,
      "doc": "The live orders table \u2014 highest-traffic table in the schema. Revenue queries should filter status='c'. Magic single-char statuses: 'p'=pending, 'c'=complete, 'x'=cancelled, 'r'=refunded. FK to users was dropped during a hotfix migration and never restored.",
      "issues": [
        "Missing FK: user_id \u2192 users.id",
        "Missing FK: workspace_id \u2192 workspaces.id",
        "Magic status values ('p','c','x','r')"
      ],
      "columns": [
        {
          "name": "id",
          "type": "bigint",
          "doc": "Primary key."
        },
        {
          "name": "user_id",
          "type": "bigint",
          "doc": "Logical FK to users.id (dropped in hotfix, not restored).",
          "flag": true
        },
        {
          "name": "workspace_id",
          "type": "bigint",
          "doc": "Logical FK to workspaces.id (not enforced).",
          "flag": true
        },
        {
          "name": "amount_cents",
          "type": "integer",
          "doc": "Order value in cents (legacy orders used dollars)."
        },
        {
          "name": "status",
          "type": "text",
          "doc": "'p'=pending 'c'=complete 'x'=cancelled 'r'=refunded. Enforced nowhere.",
          "flag": true
        },
        {
          "name": "meta",
          "type": "jsonb",
          "doc": "Observed keys: src ('web'|'api'), coupon, reason."
        },
        {
          "name": "created_at",
          "type": "timestamptz",
          "doc": "Creation time."
        }
      ]
    },
    {
      "name": "order_items",
      "rows": 0,
      "status": "critical",
      "readsPerDay": 8800,
      "writesPerDay": 0,
      "doc": "Line items. BUG: order_id still has an FK to legacy `orders`, not `orders_v2` \u2014 inserts against v2 order ids fail the constraint, which is why the table is empty and app code stuffs line items into orders_v2.meta instead.",
      "issues": [
        "FK points at deprecated table (orders, should be orders_v2)",
        "Empty despite 8.8k reads/day \u2014 app worked around it"
      ],
      "columns": [
        {
          "name": "id",
          "type": "bigint",
          "doc": "Primary key."
        },
        {
          "name": "order_id",
          "type": "bigint",
          "doc": "FK \u2192 orders.id (WRONG TARGET \u2014 should be orders_v2).",
          "flag": true
        },
        {
          "name": "product_id",
          "type": "bigint",
          "doc": "Logical FK to products.id (not enforced).",
          "flag": true
        },
        {
          "name": "qty",
          "type": "integer",
          "doc": "Quantity, default 1."
        },
        {
          "name": "unit_price_cents",
          "type": "integer",
          "doc": "Price snapshot at purchase time."
        }
      ]
    },
    {
      "name": "products",
      "rows": 3,
      "status": "healthy",
      "readsPerDay": 15200,
      "writesPerDay": 2,
      "doc": "Sellable SKUs (currently: subscription plans and seat add-ons). Prices in cents. `active` soft-deletes.",
      "issues": [],
      "columns": [
        {
          "name": "id",
          "type": "bigint",
          "doc": "Primary key."
        },
        {
          "name": "sku",
          "type": "text",
          "doc": "Human-readable SKU (e.g. PLN-PRO)."
        },
        {
          "name": "title",
          "type": "text",
          "doc": "Display title."
        },
        {
          "name": "price_cents",
          "type": "integer",
          "doc": "Current list price in cents."
        },
        {
          "name": "active",
          "type": "boolean",
          "doc": "Soft-delete flag."
        },
        {
          "name": "created_at",
          "type": "timestamptz",
          "doc": "Creation time."
        }
      ]
    },
    {
      "name": "product_catalog_old",
      "rows": 1,
      "status": "critical",
      "readsPerDay": 0,
      "writesPerDay": 0,
      "doc": "Orphan. Pre-migration product catalog, zero reads since Aug 2025. Uses FLOAT for money. Safe to archive and drop.",
      "issues": [
        "Orphaned: zero reads in 90 days",
        "FLOAT used for currency"
      ],
      "columns": [
        {
          "name": "pid",
          "type": "integer",
          "doc": "Old primary key (no constraint)."
        },
        {
          "name": "name",
          "type": "varchar(255)",
          "doc": "Product name."
        },
        {
          "name": "price",
          "type": "float",
          "doc": "Price in dollars as float \u2014 precision hazard.",
          "flag": true
        },
        {
          "name": "cat",
          "type": "varchar(64)",
          "doc": "Category slug."
        }
      ]
    },
    {
      "name": "payments",
      "rows": 3,
      "status": "warning",
      "readsPerDay": 6400,
      "writesPerDay": 90,
      "doc": "Payment records reconciled from Stripe webhooks. `state` uses Stripe vocabulary ('succeeded','refunded') \u2014 a third status vocabulary in this schema. No FK to orders_v2; reconciliation happens in app code.",